{
  "feed": "Longevity Cell Therapy Weekly",
  "tier": "free-headlines",
  "issue": 4,
  "date_range": {
    "start": "2026-10-19",
    "end": "2026-10-25",
    "timezone": "America/Chicago"
  },
  "generated_at": "2026-10-26T14:30:00Z",
  "item_count": 19,
  "paid_tier": {
    "status": "coming soon",
    "includes": [
      "study_type",
      "authors",
      "key_readouts_or_biomarkers",
      "manufacturing_relevance",
      "limitations",
      "evidence_strength",
      "why_it_matters_for_builders",
      "cross_item_notes",
      "editor_note"
    ],
    "price_usdc": 0.25,
    "protocol": "x402",
    "network": "Base"
  },
  "license": "Summaries CC BY 4.0 (https://creativecommons.org/licenses/by/4.0/). Titles, DOIs and links are factual metadata; follow each link for the source and its own license.",
  "disclaimer": "Not medical advice. Research summaries for information only, based on public abstracts (and full text where noted in summary_basis). Preprints are not peer reviewed. Evidence ratings are editorial judgments, not endorsements. Verify against the original source before relying on any detail.",
  "schema": "https://recs84.github.io/longevity-cell-therapy-weekly/schema/headlines.schema.json",
  "items": [
    {
      "id": "lctw-004-01",
      "title": "Design and validation of a GMP-compliant manufacturing platform of extracellular vesicles from mesenchymal stromal cells",
      "source": "iScience",
      "posted_date": "2026-10-25",
      "finding": "A GMP-compliant, semi-automated mid-scale workflow (single-use stirred-tank expansion of Wharton's jelly MSCs, tangential flow filtration, automated size-exclusion chromatography, in-line CPP monitoring) produced MSC-EVs that met pre-specified CQAs, with CQAs including CD73-associated immunomodulatory activity holding for 12 months at -80C in PlasmaLyte 148.",
      "url": "https://doi.org/10.1016/j.isci.2026.117881",
      "doi": "10.1016/j.isci.2026.117881",
      "topic_tags": [
        "msc",
        "wharton_jelly",
        "evs",
        "gmp",
        "stirred_tank_bioreactor",
        "tff",
        "sec",
        "manufacturing",
        "stability"
      ],
      "preprint": false
    },
    {
      "id": "lctw-004-02",
      "title": "Peptide sequence and backbone conjugation chemistry direct alginate hydrogel bioactivity for human mesenchymal stem cell expansion",
      "source": "Bioconjugate Chemistry",
      "posted_date": "2026-10-23",
      "finding": "On calcium-crosslinked alginate films, GGFTRGD or CGFTRGD peptides failed to support hMSC expansion, while adding a C-terminal SP (GGFTRGDSP or CGFTRGDSP, closer to native fibronectin) gave robust attachment and a more than 10-fold increase in final cell number; NMR confirmed DMTMM coupling ran through the peptide N-terminus.",
      "url": "https://doi.org/10.1021/acs.bioconjchem.6c00209",
      "doi": "10.1021/acs.bioconjchem.6c00209",
      "topic_tags": [
        "msc",
        "expansion",
        "alginate",
        "rgd",
        "biomaterials",
        "manufacturing"
      ],
      "preprint": false
    },
    {
      "id": "lctw-004-03",
      "title": "Ion-enriched solution improves the adhesion of freshly thawed umbilical cord-derived mesenchymal stem cells and supports cartilage repair in a rat full-thickness cartilage defect model",
      "source": "Tissue Engineering and Regenerative Medicine",
      "posted_date": "2026-10-23",
      "finding": "Freshly thawed UC-MSCs had lower proliferation, metabolic activity and adhesion than culture-recovered cells; an ion-enriched carrier (MgCl2 the main contributor, sodium acetate possibly) raised their adhesion in vitro and on OA cartilage ex vivo, and in rats gave 8-week cartilage repair comparable to culture-recovered UC-MSCs in saline.",
      "url": "https://doi.org/10.1007/s13770-026-00844-y",
      "doi": "10.1007/s13770-026-00844-y",
      "topic_tags": [
        "msc",
        "umbilical_cord_msc",
        "cryopreservation",
        "thaw_and_inject",
        "formulation",
        "cartilage"
      ],
      "preprint": false
    },
    {
      "id": "lctw-004-04",
      "title": "Cell cryoisolation and cryopreservation without any organic solvent",
      "source": "Biomacromolecules",
      "posted_date": "2026-10-23",
      "finding": "Aptamer-targeted DNA nanohydrogels delivering trehalose into cells within 2 h gave post-thaw viability comparable to DMSO with 67% fewer differentially expressed genes, extended to MSCs, and used differential freeze-thaw survival to isolate target cells label-free at more than 95% purity.",
      "url": "https://doi.org/10.1021/acs.biomac.6c00813",
      "doi": "10.1021/acs.biomac.6c00813",
      "topic_tags": [
        "cryopreservation",
        "dmso_free",
        "trehalose",
        "aptamer",
        "msc",
        "cell_isolation",
        "manufacturing"
      ],
      "preprint": false
    },
    {
      "id": "lctw-004-05",
      "title": "Quantifying punctate morphology in mesenchymal stem cells from single cell images provides a definitive quality assessment pipeline for direct correlation to osteogenic lineage differentiation",
      "source": "bioRxiv (preprint)",
      "posted_date": "2026-10-23",
      "finding": "The authors extend an image-based single-cell pipeline (MSCProfiler) to combine bright-field shape features with SA-beta-gal punctate staining across early, mid and late passages of dental pulp MSCs, and relate puncta morphology to osteogenic differentiation capacity.",
      "url": "https://www.biorxiv.org/content/10.64898/2026.10.22.760947v1",
      "doi": "10.64898/2026.10.22.760947",
      "topic_tags": [
        "msc",
        "dental_pulp_msc",
        "senescence",
        "imaging",
        "quality_control",
        "potency_assay"
      ],
      "preprint": true
    },
    {
      "id": "lctw-004-06",
      "title": "A circRNA platform for safe partial reprogramming and rejuvenation of mesenchymal stem cells without pluripotent conversion",
      "source": "Stem Cell Research & Therapy",
      "posted_date": "2026-10-22",
      "finding": "LNP-delivered circRNA co-expressing OCT4, SOX2 and KLF4 (circ-OSK) rejuvenated late-passage MSCs (lower SA-beta-gal, DNA damage and inflammatory cytokines; proliferation, migration and tri-lineage capacity restored to early-passage levels) without pluripotent conversion by ESRG ddPCR, with MSC markers and genome stability preserved by RNA-seq and SNP array.",
      "url": "https://doi.org/10.1186/s13287-026-05193-0",
      "doi": "10.1186/s13287-026-05193-0",
      "topic_tags": [
        "msc",
        "partial_reprogramming",
        "circrna",
        "lnp",
        "osk",
        "senescence",
        "rejuvenation",
        "manufacturing"
      ],
      "preprint": false
    },
    {
      "id": "lctw-004-07",
      "title": "Osteogenic culture of human adipose stem cells on electrospun multispiral poly(e-caprolactone)/beta-tricalcium phosphate composite scaffold in a perfusion bioreactor",
      "source": "Journal of Bioscience and Bioengineering",
      "posted_date": "2026-10-22",
      "finding": "Over 28 days, hASCs on multispiral PCL/beta-TCP scaffolds in a perfusion bioreactor (4.375 mL/min per channel) produced significantly more mineralized matrix and better mechanical performance than static culture, with robust viability in both.",
      "url": "https://doi.org/10.1016/j.jbiosc.2026.09.009",
      "doi": "10.1016/j.jbiosc.2026.09.009",
      "topic_tags": [
        "msc",
        "adipose_msc",
        "perfusion_bioreactor",
        "scaffold",
        "bone",
        "manufacturing"
      ],
      "preprint": false
    },
    {
      "id": "lctw-004-08",
      "title": "Pulsed focused ultrasound-mediated mechanopriming enhances the therapeutic efficacy of mesenchymal stromal cell-derived extracellular vesicles in acute respiratory distress syndrome",
      "source": "Journal of Extracellular Vesicles",
      "posted_date": "2026-10-25",
      "finding": "A single 1-minute pulsed focused ultrasound exposure of UC-MSCs raised EV concentration 1.9-fold without changing size, via calcium-dependent ESCRT upregulation (blocked by EGTA); primed EVs carried more mitochondrial OXPHOS proteins and, in juvenile LPS-ARDS, beat unprimed EVs on barrier integrity, BAL protein, cytokines, neutrophils and histology, with lower serum IgG binding.",
      "url": "https://doi.org/10.1002/jev2.70380",
      "doi": "10.1002/jev2.70380",
      "topic_tags": [
        "msc",
        "umbilical_cord_msc",
        "evs",
        "mechanopriming",
        "ultrasound",
        "ards",
        "manufacturing"
      ],
      "preprint": false
    },
    {
      "id": "lctw-004-09",
      "title": "Increased EV yield and bioactivity of matrix-bound nanovesicles compared to conditioned culture medium-derived extracellular vesicles",
      "source": "bioRxiv (preprint)",
      "posted_date": "2026-10-23",
      "finding": "From the same MSC cultures, matrix-bound nanovesicles out-yielded medium EVs 15.6-fold by ultracentrifugation and 7.49-fold by SEC, SEC beat UC for both, day 24 gave the most MBVs, and in a fibroblast scratch assay medium EVs slowed wound closure versus control while MBVs did not.",
      "url": "https://www.biorxiv.org/content/10.64898/2026.10.21.760728v1",
      "doi": "10.64898/2026.10.21.760728",
      "topic_tags": [
        "msc",
        "evs",
        "matrix_bound_nanovesicles",
        "isolation",
        "sec",
        "ultracentrifugation",
        "manufacturing"
      ],
      "preprint": true
    },
    {
      "id": "lctw-004-10",
      "title": "Protective effects of PD-L1-overexpressing MSCs and their derived extracellular vesicles in type 1 diabetes",
      "source": "Diabetes",
      "posted_date": "2026-10-23",